{"schema_version":1,"job_id":"gallery-article-boundary","publish_target":"article-body","source":{"kind":"pasted-text","language":"zh","label":"《千脑智能》· 杰夫·霍金斯"},"source_units":[{"id":"boundary","excerpt":"物体模型需要把感知到的特征放在以物体为中心的参考系中；位置让特征成为可预测的结构。"}],"decision":{"mode":"article-diagram","tier":"stable","tone":"technical","reason":"保留 legacy boundary model，同时把边界改为物体参考系的内外关系。"},"outputs":[{"id":"boundary","basename":"article-boundary-legacy.png","source_unit_ids":["boundary"],"transformation":"visualize","render_contract":{"mode":"article-diagram","tone":"technical","family":"boundary-model","title":"特征必须落在物体坐标里","nodes":[{"id":"feature","label":"感觉特征","zone":"outside"},{"id":"location","label":"相对位置","zone":"object"},{"id":"model","label":"物体模型","zone":"prediction"}],"zones":[{"id":"outside","label":"此刻感觉"},{"id":"object","label":"物体参考系"},{"id":"prediction","label":"下一次预测"}],"caption":"位置把瞬时感觉接入可预测的物体结构。"}}]}
