{"schema_version":1,"job_id":"gallery-long","publish_target":"long-read","source":{"kind":"pasted-text","language":"zh","label":"《千脑智能》· 杰夫·霍金斯"},"source_units":[{"id":"opening","excerpt":"书中将新皮层描述为学习世界模型的记忆系统：它通过感觉、运动和预测认识物体。"}],"decision":{"mode":"long","tier":"stable","tone":"warm","reason":"这一段需要保留从常识反转到机制解释的阅读节奏。"},"outputs":[{"id":"long","basename":"long.png","source_unit_ids":["opening"],"transformation":"preserve","render_contract":{"mode":"long","tone":"warm","title":"智能来自世界模型","source":"《千脑智能》· 杰夫·霍金斯","body":[{"type":"paragraph","dropcap":true,"text":"我们常把大脑想成接收感觉、计算答案的机器。《千脑智能》提出了另一幅图景：新皮层更像一套持续建立世界模型的记忆系统。"},{"type":"paragraph","text":"手指沿着杯沿移动时，感觉会改变；但如果知道自己正位于杯子的哪个位置，改变就能被预测。于是，物体不再是一串输入，而是带有结构的模型。"},{"type":"highlight","text":"理解，是在运动中不断证实“我正处在世界的哪里”。"}]}}]}
