{"schema_version":1,"job_id":"gallery-big","publish_target":"social-single","source":{"kind":"pasted-text","language":"en"},"source_units":[{"id":"claim","excerpt":"Clarity is a decision readers can see."}],"decision":{"mode":"big","tier":"stable","tone":"sharp","reason":"A single claim needs a single reading surface."},"outputs":[{"id":"big","basename":"big.png","source_unit_ids":["claim"],"transformation":"preserve","render_contract":{"mode":"big","tone":"sharp","phrase":"Clarity<br>is a decision"}}]}
