{"schema_version":1,"job_id":"gallery-editorial-wechat","publish_target":"wechat-cover","source":{"kind":"pasted-text","language":"en"},"source_units":[{"id":"thesis","excerpt":"An archive makes the next decision retrievable."}],"decision":{"mode":"editorial-image","tier":"stable","tone":"reflective","reason":"A cover needs one concrete metaphor instead of a summary."},"outputs":[{"id":"cover","basename":"editorial-wechat-cover.png","source_unit_ids":["thesis"],"transformation":"visualize","render_contract":{"mode":"editorial-image","title":"Memory returns","use":"cover","aspect":"wechat-cover","editorial_tone":"reflective","cover_motif":"archive","visual_metaphor":"An archive keeps decisions retrievable."}}]}
