{
  "schema_version": 1,
  "job_id": "gallery-sketchnote",
  "publish_target": "long-read",
  "source": {
    "kind": "pasted-text",
    "language": "zh",
    "label": "《千脑智能》：从感觉到物体模型"
  },
  "source_units": [
    {
      "id": "arc",
      "excerpt": "皮层柱把感知到的特征放在物体参考系中，再通过运动更新位置并预测新的感觉。"
    }
  ],
  "decision": {
    "mode": "sketchnote",
    "tier": "studio",
    "tone": "warm",
    "reason": "感觉、定位与预测形成一条清晰的认识弧线，适合长幅手记。",
    "selection_summary": "用三站式手记连接感觉、参考系与预测。",
    "visual_risks": [
      "装饰性涂鸦不能压过从感觉到预测的认识顺序"
    ]
  },
  "outputs": [
    {
      "id": "sketchnote",
      "basename": "sketchnote.png",
      "source_unit_ids": [
        "arc"
      ],
      "transformation": "visualize",
      "render_contract": {
        "mode": "sketchnote",
        "title": "一个物体，是怎样被认识的？",
        "subtitle": "《千脑智能》：从感觉到可预测的模型",
        "composition_required": true,
        "tone": "warm",
        "content_html": "<header class=\"opening\"><span class=\"kicker\">THOUSAND BRAINS / 01</span><h1>一个物体，<br>怎样被认识？</h1><p>不是把特征堆在一起，而是让感觉、位置和运动落进同一个模型。</p></header><main class=\"journey\"><article class=\"station recall\"><b>01</b><div><span class=\"label\">SENSE</span><h2>先遇见局部感觉</h2><p>摸到边缘、纹理或曲面，只得到一个尚未确定的线索。</p></div><i>↘</i></article><article class=\"station act\"><b>02</b><div><span class=\"label\">LOCATE</span><h2>把它放进参考系</h2><p>知道特征位于物体哪里，移动才有了可追踪的位置。</p></div><i>↙</i></article><article class=\"station bound\"><b>03</b><div><span class=\"label\">PREDICT</span><h2>预测下一次感觉</h2><p>预测不断被验证，局部线索才收敛为完整的物体模型。</p></div></article></main><footer><span>《千脑智能》的认识循环</span><strong>感觉 · 定位 · 预测</strong></footer>",
        "custom_css": ".page{padding:78px 74px 64px;display:flex;flex-direction:column;gap:44px}.opening{border-left:12px solid var(--accent);padding:12px 0 18px 34px}.opening>span{font:700 24px/1 var(--mono);letter-spacing:.1em;color:var(--accent)}.opening h1{font:700 66px/1.05 var(--serif);margin:22px 0 24px}.opening p{font:500 36px/1.45 var(--sans);max-width:850px;color:var(--ink-muted)}.journey{display:flex;flex-direction:column;gap:24px;position:relative}.station{border:2px solid var(--ink);padding:28px 34px;display:grid;grid-template-columns:88px 1fr 80px;gap:22px;align-items:center;box-shadow:10px 10px 0 var(--surface-2);transform:rotate(-.7deg)}.station:nth-child(2){margin-left:96px;transform:rotate(.8deg);background:var(--surface-1)}.station:nth-child(3){margin-right:72px;background:var(--ink);color:var(--bg);transform:rotate(-.35deg)}.station>b{font:700 54px/1 var(--mono);color:var(--accent)}.label{display:block;font:700 24px/1 var(--mono);letter-spacing:.09em;margin:0 0 8px}.station h2{font:700 40px/1.1 var(--sans);margin:0 0 10px}.station div>p:last-child{font:500 36px/1.35 var(--sans);margin:0;opacity:.72}.station i{font:700 62px/1 var(--mono);color:var(--accent);font-style:normal}footer{margin-top:auto;border-top:3px solid var(--ink);padding-top:24px;display:flex;align-items:flex-end;justify-content:space-between}footer span{font:700 24px/1 var(--mono)}footer strong{font:700 38px/1 var(--serif);color:var(--accent)}"
      }
    }
  ]
}
