{"schema_version":1,"job_id":"gallery-poster","publish_target":"social-series","source":{"kind":"pasted-text","language":"zh","label":"《千脑智能》· 杰夫·霍金斯"},"source_units":[{"id":"lesson","excerpt":"千脑理论把智能理解为许多独立模型的并行学习与横向投票，而不是一条自下而上的单一路径。"}],"decision":{"mode":"poster","tier":"stable","tone":"warm","reason":"三条并列但相互依赖的原则适合被压进一张社媒卡。"},"outputs":[{"id":"poster","basename":"poster.png","source_unit_ids":["lesson"],"transformation":"compress","render_contract":{"mode":"poster","tone":"warm","title":"《千脑智能》的三条线索","subtitle":"不是一座中枢，而是一群会建模的局部","source":"《千脑智能》· 杰夫·霍金斯","cards":[{"body":[{"type":"items","entries":[{"label":"皮层柱","text":"每个局部单元都能学习完整物体，而非只存一个特征。"},{"label":"参考系","text":"特征必须带着“在物体哪里”的位置，模型才可预测。"},{"label":"投票","text":"许多模型交换证据，逐步收敛为稳定的判断。"}]}]}]}}]}
