{"schema_version":1,"job_id":"gallery-long","publish_target":"long-read","source":{"kind":"pasted-text","language":"en"},"source_units":[{"id":"opening","excerpt":"Good writing is an arrangement of decisions."}],"decision":{"mode":"long","tier":"stable","tone":"warm","reason":"The paragraph needs reading pace, not card splitting."},"outputs":[{"id":"long","basename":"long.png","source_unit_ids":["opening"],"transformation":"preserve","render_contract":{"mode":"long","tone":"warm","title":"Writing is a sequence of choices","body":[{"type":"paragraph","dropcap":true,"text":"Good writing makes its decisions visible without making readers inspect the machinery."},{"type":"highlight","text":"Keep the argument; remove the noise."}]}}]}
