{
  "schema_version": 1,
  "job_id": "gallery-infograph",
  "publish_target": "article-body",
  "source": {
    "kind": "pasted-text",
    "language": "zh",
    "label": "《千脑智能》：从局部模型到共同判断"
  },
  "source_units": [
    {
      "id": "stages",
      "excerpt": "千脑理论将智能描述为许多皮层柱各自学习模型，再通过横向连接对同一物体达成共识。"
    }
  ],
  "decision": {
    "mode": "infograph",
    "tier": "studio",
    "tone": "technical",
    "reason": "局部建模、横向投票与稳定判断有明确的关系，适合用信息图表达。",
    "selection_summary": "用一条非对称关系链呈现局部模型如何成为共同判断。",
    "visual_risks": [
      "装饰不能压过局部模型与共同判断之间的关系"
    ]
  },
  "outputs": [
    {
      "id": "infograph",
      "basename": "infograph.png",
      "source_unit_ids": [
        "stages"
      ],
      "transformation": "visualize",
      "render_contract": {
        "mode": "infograph",
        "title": "不是一座中枢，而是一群模型",
        "subtitle": "《千脑智能》：局部学习如何成为共同判断",
        "composition_required": true,
        "tone": "technical",
        "content_html": "<main class=\"evidence-flow\"><section class=\"lead\"><span class=\"index\">01</span><p class=\"eyebrow\">LOCAL MODELS</p><h2>每个皮层柱<br>都能学习一个物体</h2><p>它从感觉和运动中，建立自己的局部世界模型。</p></section><div class=\"spine\" aria-hidden=\"true\"><span></span><span></span></div><section class=\"steps\"><article><b>02</b><div><h3>横向投票</h3><p>不同模型交换它们对同一物体的证据。</p></div></article><article><b>03</b><div><h3>稳定共识</h3><p>判断不是上报给中心，而是在协作中收敛。</p></div></article><aside>智能，是许多模型共同看见世界。</aside></section></main>",
        "custom_css": ".page{min-height:800px;padding:72px 76px 66px;display:grid}.evidence-flow{display:grid;grid-template-columns:1.12fr 70px .88fr;gap:0;align-items:stretch}.lead{background:var(--ink);color:var(--bg);padding:54px 48px;display:flex;flex-direction:column;justify-content:flex-end;min-height:590px}.index{font:700 82px/1 var(--mono);color:var(--accent)}.eyebrow{font:700 24px/1 var(--mono);letter-spacing:.12em;margin:30px 0 18px}.lead h2{font:700 46px/1.15 var(--serif);margin:0 0 24px}.lead>p:last-child{font:500 36px/1.4 var(--sans);opacity:.72}.spine{display:grid;grid-template-rows:1fr 1fr;place-items:center}.spine span{width:100%;height:2px;background:var(--accent);position:relative}.spine span:after{content:'›';position:absolute;right:-4px;top:-20px;font:700 34px/1 var(--mono);color:var(--accent)}.steps{padding:44px 0 20px;display:flex;flex-direction:column;gap:18px}.steps article{border-top:2px solid var(--ink);padding:16px 0;display:grid;grid-template-columns:58px 1fr;gap:14px}.steps b{font:700 28px/1 var(--mono);color:var(--accent)}.steps h3{font:700 32px/1.1 var(--sans);margin:0 0 8px}.steps p{font:500 36px/1.3 var(--sans);margin:0;color:var(--ink-muted)}.steps aside{margin-top:auto;background:var(--accent);color:var(--bg);padding:18px 20px;font:700 28px/1.25 var(--serif)}"
      }
    }
  ]
}
