{"schema_version":1,"job_id":"gallery-reading-report","publish_target":"reading-notes","source":{"kind":"normalized-adapter","language":"zh","label":"公开示例"},"source_units":[{"id":"review","excerpt":"阅读报告只呈现来源实际提供的统计。"}],"decision":{"mode":"poster","tier":"stable","tone":"warm","reason":"A report remains a normal poster contract and does not invent statistics."},"outputs":[{"id":"report","basename":"reading-report.png","source_unit_ids":["review"],"transformation":"compress","render_contract":{"mode":"poster","tone":"warm","title":"本月阅读","cards":[{"body":[{"type":"paragraph","text":"本示例只展示来源明确提供的内容，不制造伪精确数字。"}]}]}}]}
