{"schema_version":1,"job_id":"gallery-reading-notes","publish_target":"reading-notes","source":{"kind":"pasted-text","language":"zh","label":"《千脑智能》· 概念转述示例（非原文划线）"},"source_units":[{"id":"highlight","excerpt":"书中以皮层柱、参考系与横向投票解释大脑如何从感觉和运动中认识物体。"}],"decision":{"mode":"poster","tier":"stable","tone":"reflective","reason":"用明确标注为转述的示例，展示阅读笔记的原文—想法配对结构而不伪造书中划线。"},"outputs":[{"id":"notes","basename":"reading-notes.png","source_unit_ids":["highlight"],"transformation":"rewrite","render_contract":{"mode":"poster","variant":"reading-notes","tone":"reflective","title":"读书笔记｜概念转述","source":"《千脑智能》· 概念转述示例，非原文划线","cards":[{"title":"主题整理｜参考系让感觉可预测","body":[{"type":"reading_unit","quote":"概念转述：皮层柱把感觉特征放入物体的参考系，并用运动持续更新位置。","thought":"如果没有“我在物体哪里”，感觉只能是碎片；位置才让它们连成模型。"}]}]}}]}
