{
  "schema_version": 1,
  "job_id": "gallery-comic",
  "publish_target": "social-single",
  "source": {
    "kind": "pasted-text",
    "language": "zh",
    "label": "《千脑智能》：一个感觉不足以认识物体"
  },
  "source_units": [
    {
      "id": "dialogue",
      "excerpt": "物体通过感觉与运动被逐步识别：一个局部线索不能确定物体，新的触摸会缩小可能性。"
    }
  ],
  "decision": {
    "mode": "comic",
    "tier": "studio",
    "tone": "sharp",
    "reason": "从单一感觉到移动验证再到模型收敛，适合用连续分镜表达。",
    "selection_summary": "三格对话把局部线索、主动探索和稳定识别串起来。",
    "visual_risks": [
      "对白过多会掩盖从局部线索到模型收敛的转折"
    ]
  },
  "outputs": [
    {
      "id": "comic",
      "basename": "comic.png",
      "source_unit_ids": [
        "dialogue"
      ],
      "transformation": "rewrite",
      "render_contract": {
        "mode": "comic",
        "title": "摸到一条边，够认识杯子吗？",
        "subtitle": "《千脑智能》：认识发生在主动探索里",
        "composition_required": true,
        "tone": "sharp",
        "content_html": "<article class=\"panel panel-large scene-one\"><span class=\"beat\">01</span><div class=\"bubble\">摸到一条边。<br><strong>这是杯子？</strong></div><div class=\"touch-figure\" aria-hidden=\"true\"><span class=\"finger\"></span><span class=\"touch-point\"></span><span class=\"cup\"></span></div><div class=\"terminal\">MAYBE CUP</div></article><article class=\"panel panel-half scene-two\"><span class=\"beat\">02</span><h2>再移动</h2><p>手指沿着表面走，位置和感觉一起更新。</p><div class=\"stamp\">PREDICT</div></article><article class=\"panel panel-half scene-three\"><span class=\"beat\">03</span><h2>模型收敛</h2><p>更多线索与预测吻合，杯子才被认识。</p><div class=\"eye\">◉</div></article>",
        "custom_css": ".title-area{flex:.55;justify-content:flex-end;padding-bottom:48px}.panels{flex:1.45;grid-template-columns:1.15fr .85fr;grid-template-rows:1fr 1fr}.scene-one{grid-row:1/3;grid-column:1;background:var(--ink);color:var(--bg);display:flex;flex-direction:column;justify-content:space-between}.scene-two{grid-row:1;grid-column:2;background:var(--bg)}.scene-three{grid-row:2;grid-column:2;background:var(--accent);color:var(--bg)}.beat{font:700 24px/1 var(--mono);opacity:.55}.bubble{font:700 44px/1.24 var(--serif);border:3px solid currentColor;padding:30px;position:relative}.bubble:after{content:'';position:absolute;left:34px;bottom:-24px;border:12px solid transparent;border-top-color:currentColor}.touch-figure{position:relative;height:330px;margin:18px 0}.cup{position:absolute;right:34px;bottom:18px;width:238px;height:208px;border:6px solid currentColor;border-top-width:10px;border-radius:10px 10px 68px 68px}.cup:after{content:'';position:absolute;right:-78px;top:48px;width:74px;height:92px;border:6px solid currentColor;border-left:0;border-radius:0 50px 50px 0}.finger{position:absolute;left:18px;top:92px;width:292px;height:54px;border-top:12px solid var(--accent);border-radius:50%;transform:rotate(8deg)}.finger:before{content:'';position:absolute;left:0;top:-28px;width:108px;height:48px;border:6px solid var(--accent);border-right:0;border-radius:30px 0 0 30px}.touch-point{position:absolute;left:300px;top:124px;width:30px;height:30px;border:7px solid var(--accent);border-radius:50%}.terminal{font:700 44px/1 var(--mono);letter-spacing:-.04em;color:var(--accent)}.scene-two h2,.scene-three h2{font:800 38px/1.1 var(--sans);margin-top:auto}.scene-two p,.scene-three p{font:600 36px/1.35 var(--sans)}.stamp{display:inline-block;border:4px solid var(--accent);color:var(--accent);padding:9px 13px;transform:rotate(-8deg);font:800 21px/1 var(--mono)}.eye{font:700 84px/1 var(--mono);text-align:right}"
      }
    }
  ]
}
