{"schema_version":1,"job_id":"gallery-article-boundary","publish_target":"article-body","source":{"kind":"pasted-text","language":"en"},"source_units":[{"id":"boundary","excerpt":"Safety lives at the boundary between request and restricted resources."}],"decision":{"mode":"article-diagram","tier":"stable","tone":"technical","reason":"Legacy boundary input remains a supported compatibility route."},"outputs":[{"id":"boundary","basename":"article-boundary-legacy.png","source_unit_ids":["boundary"],"transformation":"visualize","render_contract":{"mode":"article-diagram","tone":"technical","family":"boundary-model","title":"Safety lives at the boundary","nodes":[{"id":"request","label":"Request","zone":"outside"},{"id":"harness","label":"Harness","zone":"guarded"},{"id":"files","label":"Files","zone":"restricted"}],"zones":[{"id":"outside","label":"Outside"},{"id":"guarded","label":"Guarded"},{"id":"restricted","label":"Restricted"}],"caption":"The boundary turns intent into controlled action."}}]}
