{"schema_version":1,"job_id":"gallery-article-formula","publish_target":"article-body","source":{"kind":"pasted-text","language":"en"},"source_units":[{"id":"relation","excerpt":"A constraint turns intent into an executable decision."}],"decision":{"mode":"article-diagram","tier":"stable","tone":"technical","reason":"The relationship is best preserved as one formula card."},"outputs":[{"id":"formula","basename":"article-formula.png","source_unit_ids":["relation"],"transformation":"compress","render_contract":{"mode":"article-diagram","tone":"technical","title":"Constraint makes action real","formula":"Intent + boundary = action","sentence":"A decision becomes executable only when its boundary is explicit.","structure":{"nodes":[{"id":"intent","label":"Intent"},{"id":"boundary","label":"Boundary"},{"id":"action","label":"Action"}],"relations":[{"from":"intent","to":"boundary"},{"from":"boundary","to":"action"}]}}}]}
