{"schema_version":1,"job_id":"gallery-whiteboard","publish_target":"whiteboard","source":{"kind":"pasted-text","language":"en"},"source_units":[{"id":"chain","excerpt":"Observe, name the constraint, choose, verify."}],"decision":{"mode":"whiteboard","tier":"stable","tone":"technical","reason":"The source is a visible reasoning chain."},"outputs":[{"id":"whiteboard","basename":"whiteboard.png","source_unit_ids":["chain"],"transformation":"visualize","render_contract":{"mode":"whiteboard","tone":"technical","title":"A decision chain","steps":[{"type":"annotation","text":"Observe the constraint before choosing an action."}]}}]}
